{"language":"en","mode":"parts-of-speech","questions":[{"answer":"Noun","difficulty":"basic","explanation":"The highlighted word names a person, place, thing, or concept, so it is a noun.","id":"POS-002","language":"en","mode":"parts-of-speech","options":["Noun","Proper noun","Pronoun","Adjective"],"prompt":"Which part of speech is the highlighted word?","sentence":"Sarah and her daughters arrived first.","sentence_id":"en-s000001","subskill":"Parts of speech","target_spans":[{"end":23,"start":14}]},{"answer":"Lexical verb","difficulty":"basic","explanation":"The highlighted word expresses the main action, event, or state, so it is a lexical verb.","id":"POS-003","language":"en","mode":"parts-of-speech","options":["Lexical verb","Auxiliary verb","Modal auxiliary","Adjective"],"prompt":"Which part of speech is the highlighted word?","sentence":"Sarah and her daughters arrived first.","sentence_id":"en-s000001","subskill":"Parts of speech","target_spans":[{"end":31,"start":24}]},{"answer":"Adverb","difficulty":"basic","explanation":"The highlighted word modifies a verb, adjective, clause, or the circumstances of an event, so it is an adverb.","id":"POS-004","language":"en","mode":"parts-of-speech","options":["Adverb","Adjective","Preposition","Particle"],"prompt":"Which part of speech is the highlighted word?","sentence":"Sarah and her daughters arrived first.","sentence_id":"en-s000001","subskill":"Parts of speech","target_spans":[{"end":37,"start":32}]},{"answer":"Determiner","difficulty":"basic","explanation":"The highlighted word introduces or specifies a noun phrase, so it is a determiner.","id":"POS-005","language":"en","mode":"parts-of-speech","options":["Determiner","Pronoun","Adjective","Preposition"],"prompt":"Which part of speech is the highlighted word?","sentence":"The old woman living in the basement needs help.","sentence_id":"en-s000002","subskill":"Parts of speech","target_spans":[{"end":3,"start":0}]},{"answer":"Adjective","difficulty":"basic","explanation":"The highlighted word describes a noun or functions as an adjectival complement, so it is an adjective.","id":"POS-006","language":"en","mode":"parts-of-speech","options":["Adjective","Adverb","Noun","Determiner"],"prompt":"Which part of speech is the highlighted word?","sentence":"The old woman living in the basement needs help.","sentence_id":"en-s000002","subskill":"Parts of speech","target_spans":[{"end":7,"start":4}]},{"answer":"Noun","difficulty":"basic","explanation":"The highlighted word names a person, place, thing, or concept, so it is a noun.","id":"POS-007","language":"en","mode":"parts-of-speech","options":["Noun","Proper noun","Pronoun","Adjective"],"prompt":"Which part of speech is the highlighted word?","sentence":"The old woman living in the basement needs help.","sentence_id":"en-s000002","subskill":"Parts of speech","target_spans":[{"end":13,"start":8}]},{"answer":"Preposition","difficulty":"basic","explanation":"The highlighted word heads a prepositional phrase and expresses a relation such as place, direction, or accompaniment.","id":"POS-008","language":"en","mode":"parts-of-speech","options":["Preposition","Particle","Subordinator","Infinitival marker"],"prompt":"Which part of speech is the highlighted word?","sentence":"The old woman living in the basement needs help.","sentence_id":"en-s000002","subskill":"Parts of speech","target_spans":[{"end":19,"start":17}]},{"answer":"Lexical verb","difficulty":"basic","explanation":"The highlighted word expresses the main action, event, or state, so it is a lexical verb.","id":"POS-009","language":"en","mode":"parts-of-speech","options":["Lexical verb","Auxiliary verb","Modal auxiliary","Adjective"],"prompt":"Which part of speech is the highlighted word?","sentence":"The old woman living in the basement needs help.","sentence_id":"en-s000002","subskill":"Parts of speech","target_spans":[{"end":42,"start":37}]},{"answer":"Pronoun","difficulty":"basic","explanation":"The highlighted word stands in for a noun phrase or refers to a participant, so it is a pronoun.","id":"POS-010","language":"en","mode":"parts-of-speech","options":["Pronoun","Determiner","Noun","Proper noun"],"prompt":"Which part of speech is the highlighted word?","sentence":"It is important to know the truth.","sentence_id":"en-s000003","subskill":"Parts of speech","target_spans":[{"end":2,"start":0}]},{"answer":"Adjective","difficulty":"basic","explanation":"The highlighted word describes a noun or functions as an adjectival complement, so it is an adjective.","id":"POS-011","language":"en","mode":"parts-of-speech","options":["Adjective","Adverb","Noun","Determiner"],"prompt":"Which part of speech is the highlighted word?","sentence":"It is important to know the truth.","sentence_id":"en-s000003","subskill":"Parts of speech","target_spans":[{"end":15,"start":6}]},{"answer":"Infinitival marker","difficulty":"basic","explanation":"The highlighted “to” introduces an infinitival verb form, so it is an infinitival marker rather than a preposition.","id":"POS-012","language":"en","mode":"parts-of-speech","options":["Infinitival marker","Preposition","Subordinator","Particle"],"prompt":"Which part of speech is the highlighted word?","sentence":"It is important to know the truth.","sentence_id":"en-s000003","subskill":"Parts of speech","target_spans":[{"end":18,"start":16}]},{"answer":"Pronoun","difficulty":"basic","explanation":"The highlighted word stands in for a noun phrase or refers to a participant, so it is a pronoun.","id":"POS-013","language":"en","mode":"parts-of-speech","options":["Pronoun","Determiner","Noun","Proper noun"],"prompt":"Which part of speech is the highlighted word?","sentence":"To have seen him lose his temper was unexpected.","sentence_id":"en-s000004","subskill":"Parts of speech","target_spans":[{"end":16,"start":13}]},{"answer":"Auxiliary verb","difficulty":"intermediate","explanation":"The highlighted word helps form tense, aspect, voice, negation, or question structure, so it is an auxiliary verb.","id":"POS-014","language":"en","mode":"parts-of-speech","options":["Auxiliary verb","Modal auxiliary","Lexical verb","Particle"],"prompt":"Which part of speech is the highlighted word?","sentence":"John was sent a copy of the letter to the president.","sentence_id":"en-s000005","subskill":"Parts of speech","target_spans":[{"end":8,"start":5}]},{"answer":"Lexical verb","difficulty":"basic","explanation":"The highlighted word expresses the main action, event, or state, so it is a lexical verb.","id":"POS-015","language":"en","mode":"parts-of-speech","options":["Lexical verb","Auxiliary verb","Modal auxiliary","Adjective"],"prompt":"Which part of speech is the highlighted word?","sentence":"Writing a letter of application proved difficult.","sentence_id":"en-s000006","subskill":"Parts of speech","target_spans":[{"end":7,"start":0}]},{"answer":"Determiner","difficulty":"basic","explanation":"The highlighted word introduces or specifies a noun phrase, so it is a determiner.","id":"POS-016","language":"en","mode":"parts-of-speech","options":["Determiner","Pronoun","Adjective","Preposition"],"prompt":"Which part of speech is the highlighted word?","sentence":"Writing a letter of application proved difficult.","sentence_id":"en-s000006","subskill":"Parts of speech","target_spans":[{"end":9,"start":8}]},{"answer":"Noun","difficulty":"basic","explanation":"The highlighted word names a person, place, thing, or concept, so it is a noun.","id":"POS-017","language":"en","mode":"parts-of-speech","options":["Noun","Proper noun","Pronoun","Adjective"],"prompt":"Which part of speech is the highlighted word?","sentence":"Writing a letter of application proved difficult.","sentence_id":"en-s000006","subskill":"Parts of speech","target_spans":[{"end":31,"start":20}]},{"answer":"Auxiliary verb","difficulty":"basic","explanation":"The highlighted word helps form tense, aspect, voice, negation, or question structure, so it is an auxiliary verb.","id":"POS-018","language":"en","mode":"parts-of-speech","options":["Auxiliary verb","Modal auxiliary","Lexical verb","Particle"],"prompt":"Which part of speech is the highlighted word?","sentence":"Did the children play?","sentence_id":"en-s000007","subskill":"Parts of speech","target_spans":[{"end":3,"start":0}]},{"answer":"Lexical verb","difficulty":"basic","explanation":"The highlighted word expresses the main action, event, or state, so it is a lexical verb.","id":"POS-019","language":"en","mode":"parts-of-speech","options":["Lexical verb","Auxiliary verb","Modal auxiliary","Adjective"],"prompt":"Which part of speech is the highlighted word?","sentence":"Did the children play?","sentence_id":"en-s000007","subskill":"Parts of speech","target_spans":[{"end":21,"start":17}]},{"answer":"Proper noun","difficulty":"intermediate","explanation":"The highlighted word is the individual name of a person or place, so it is a proper noun.","id":"POS-020","language":"en","mode":"parts-of-speech","options":["Proper noun","Noun","Pronoun","Adjective"],"prompt":"Which part of speech is the highlighted word?","sentence":"John was sent a copy of the letter to the president.","sentence_id":"en-s000005","subskill":"Parts of speech","target_spans":[{"end":4,"start":0}]},{"answer":"Determiner","difficulty":"intermediate","explanation":"The highlighted word introduces or specifies a noun phrase, so it is a determiner.","id":"POS-021","language":"en","mode":"parts-of-speech","options":["Determiner","Pronoun","Adjective","Preposition"],"prompt":"Which part of speech is the highlighted word?","sentence":"John was sent a copy of the letter to the president.","sentence_id":"en-s000005","subskill":"Parts of speech","target_spans":[{"end":27,"start":24}]},{"answer":"Preposition","difficulty":"intermediate","explanation":"The highlighted word heads a prepositional phrase and expresses a relation such as place, direction, or accompaniment.","id":"POS-022","language":"en","mode":"parts-of-speech","options":